{
  "schema_version": 1,
  "id": "org.republic-observatory.high-contrast",
  "version": "1.0.0",
  "name": "Republic Observatory High Contrast",
  "author": "Republic Observatory contributors",
  "description": "A reviewed high-contrast built-in Republic Observatory appearance.",
  "colours": {
    "canvas": "#000000",
    "surface": "#080808",
    "surface_raised": "#101010",
    "surface_soft": "#181818",
    "text": "#FFFFFF",
    "text_muted": "#D9D9D9",
    "line": "#A8A8A8",
    "accent": "#FFD84D",
    "observed": "#67E8F9",
    "risk": "#FF8A80",
    "success": "#77F2A1",
    "comparison": "#D8B4FE"
  },
  "chart_palette": ["#67E8F9", "#FFD84D", "#FF8A80", "#77F2A1", "#D8B4FE"]
}
